{
  "protocolVersion": "0.1.0",
  "eventId": "sess-1-0006",
  "eventType": "attempt.started",
  "runId": "run-ev-0001",
  "sessionId": "sess-1",
  "sequence": 6,
  "occurredAt": "2026-09-11T10:00:05.000+00:00",
  "payload": {
    "attemptId": "a-3",
    "attemptNumber": 3,
    "test": {
      "executionId": "t-3",
      "historicalId": "x[3]",
      "historicalIdStability": "uncertain",
      "displayName": "third try",
      "path": []
    }
  }
}