{
  "protocolVersion": "0.1.0",
  "eventId": "sess-1-0001",
  "eventType": "session.started",
  "runId": "run-ev-0001",
  "sessionId": "sess-1",
  "sequence": 1,
  "occurredAt": "2026-09-11T10:00:00.000+00:00",
  "payload": {
    "producer": {
      "name": "fixture",
      "version": "0.1.0"
    }
  }
}