{
  "protocolVersion": "0.2.0",
  "eventId": "sess-1-0016",
  "eventType": "step.started",
  "runId": "run-ev-0001",
  "sessionId": "sess-1",
  "sequence": 16,
  "occurredAt": "2026-09-11T10:00:15.000+00:00",
  "payload": {
    "stepId": "st-2",
    "attemptId": "a-1",
    "parentStepId": "st-1",
    "name": "nested step",
    "kind": "expect",
    "location": {
      "file": "a.spec",
      "line": 4
    }
  }
}